SEO Factor Type,Issue Name,Issue Details,Affected,How to Fix,Useful Links,Category,Impact
"Weakness","Heading Hierarchy Issues","Threat: Having issues with the heading hierarchy in the HTML source code of your webpage can cause various issues. Headings (H1, H2, H3, etc.) are crucial for SEO as they define the structure and hierarchy of the webpage content, helping search engines understand the organization and importance of the information. Heading hierarchy issues can lead to:Inaccurate search engine indexing.

Poor search engine ranking due to misinterpreted content structure.

Decreased user experience as users may find it difficult to navigate and understand the content.

Potential accessibility issues for users relying on screen readers.Ensuring that your webpage has a clear and logical heading hierarchy is crucial for maintaining a well-organized and effective presence in search engine results.","Affected URL
https://restaurantpack.se/","How to Fix: To resolve the issue of heading hierarchy, follow these steps:Inspect Your HTML Code:

Review the HTML source code of your webpage to locate all heading tags (H1, H2, H3, etc.).

Correct the Hierarchy:

Ensure that there is only one H1 tag that represents the main topic of the page.

Use H2 tags for the main sections under the H1 heading.

Use H3 tags for subsections under each H2 heading, and so on.

Avoid skipping heading levels (e.g., going from H1 to H3 without an H2).

Optimize the Headings:

Ensure that each heading is unique, descriptive, and includes relevant keywords for SEO purposes. They should accurately represent the content of the sections they introduce.

Validate Your Changes:

Use SEOwallet or any other SEO audit tool to confirm that your page now has a well-structured heading hierarchy.","Useful Links: For further guidance and best practices on managing your webpage's heading hierarchy, refer to the following resources:
H1 Tag Guidelines by Google
https://developers.google.com/style/headings
Header Tag Best Practices
https://seodebate.com/articles/header-tags/
These resources provide detailed information on how to create effective and compliant heading structures for your web pages.","On-Page","High"
"Weakness","Hreflang: Duplicate Alternate URLs","Threat: Having duplicate alternate URLs in hreflang tags within the HTML source code of your webpage can cause various issues. The hreflang attribute is crucial for SEO as it helps search engines understand the language and regional targeting of a webpage. Duplicate alternate URLs in hreflang tags can lead to:Confusion for search engines, causing indexing issues.

Incorrect regional or language targeting.

Poor search engine ranking for specific regions or languages.

Decreased user experience due to improper language or regional versions being served.Ensuring that each hreflang tag points to a unique, correct alternate URL is crucial for maintaining accurate language and regional targeting in search engine results.","Affected URL
https://restaurantpack.se/","How to Fix: To resolve the issue of duplicate alternate URLs in hreflang tags, follow these steps:Inspect Your HTML Code:

Review the HTML source code of your webpage to locate all instances of the hreflang tag.

Identify Duplicates:

Identify any hreflang tags that point to the same alternate URL.

Remove Redundant Tags:

Remove any duplicate hreflang tags, ensuring that each hreflang tag points to a unique alternate URL.

Optimize the Remaining Hreflang Tags:

Ensure that each hreflang tag accurately represents the language and regional targeting for the respective alternate URL.

Validate Your Changes:

Use SEOwallet or any other SEO audit tool to confirm that your page now contains unique hreflang tags pointing to distinct alternate URLs.","Useful Links: For further guidance and best practices on managing your webpage's hreflang tags, refer to the following resources:
Hreflang Guidelines by Google 
https://developers.google.com/search/docs/specialty/international/localized-versions
Understanding and Implementing Hreflang Tags 
https://seodebate.com/articles/hreflang/
These resources provide detailed information on how to create effective and compliant hreflang tags for your web pages.","Technical SEO","High"
"Weakness","Missing Keyword in H1 Tag","Threat: Having a <h1> tag that does not include the primary keyword can cause various issues. The <h1> tag is crucial for SEO as it defines the main heading of the webpage, which search engines use to understand the primary topic of the page. A missing keyword in the <h1> tag can lead to:Inaccurate search engine indexing.

Poor search engine ranking for the targeted keyword.

Decreased relevance of the page content to search queries.

Missed opportunities to improve on-page SEO and user experience.Ensuring that your webpage's <h1> tag includes the primary keyword is crucial for maintaining a clear and effective presence in search engine results.","Affected URL
https://restaurantpack.se/","How to Fix: To resolve the issue of a missing keyword in the <h1> tag, follow these steps:Inspect Your HTML Code:

Review the HTML source code of your webpage to locate the <h1> tag.

Update the H1 Tag:

Edit the content of the <h1> tag to include the primary keyword.

Optimize the Heading:

Ensure that the <h1> tag is unique, descriptive, and includes relevant keywords for SEO purposes. It should accurately represent the main topic of the page.

Validate Your Changes:

Use SEOwallet or any other SEO audit tool to confirm that your page's <h1> tag now includes the primary keyword.","Useful Links: For further guidance and best practices on managing your webpage's <h1> tags, refer to the following resources:
H1 Tag Guidelines by Google
https://developers.google.com/style/headings
Header Tags Best Practices
https://seodebate.com/articles/header-tags/
These resources provide detailed information on how to create effective and compliant <h1> tags for your web pages.","On-Page","High"
"Weakness","Keyword Density Threshold (0.8% or Higher)","Threat: Having a keyword density of 0.8% or higher in the content of your webpage can cause various issues. Keyword density refers to the percentage of times a keyword or phrase appears on a webpage compared to the total number of words. Excessive keyword usage (keyword stuffing) can lead to:Penalties from search engines for keyword stuffing.

Poor search engine ranking due to non-compliance with SEO best practices.

Decreased readability and user experience as the content may appear unnatural and forced.

Reduced credibility as users may perceive the content as spammy.Ensuring that your webpage has an appropriate keyword density is crucial for maintaining a clear and effective presence in search engine results.","Affected URL
https://restaurantpack.se/","How to Fix: To resolve the issue of excessive keyword density, follow these steps:Inspect Your Content:

Review the content of your webpage to identify the keywords and their frequency.

Adjust Keyword Usage:

Reduce the frequency of the target keyword or phrase to achieve a more natural and user-friendly density. Aim for a density below 0.8%.

Ensure that the content flows naturally and provides value to the reader without overusing keywords.

Enhance Content Quality:

Focus on creating high-quality, informative, and engaging content that addresses the needs of your audience.

Use synonyms and related terms to maintain relevance without overloading on a single keyword.

Validate Your Changes:

Use SEOwallet or any other SEO audit tool to confirm that your page's keyword density is within the recommended range.","Useful Links: For further guidance and best practices on managing your webpage's keyword density, refer to the following resources:
Spam policies for Google web search 
https://developers.google.com/search/docs/essentials/spam-policies
SEO Best Practices for Keyword Usage 
https://seodebate.com/articles/keyword-density/
These resources provide detailed information on how to maintain effective and compliant keyword usage for your web pages.","On-Page","High"
"Weakness","Missing Keyword in Alt Attributes","Threat: Having missing keywords in the <img> alt attributes can cause various issues. The alt attribute is important for SEO as it provides a text alternative for images, which search engines use to understand the content of the images. Missing keywords in alt attributes can lead to:Inaccurate search engine indexing of images.

Missed opportunities for ranking in image search results.

Decreased relevance and context for search engines.

Reduced accessibility for visually impaired users relying on screen readers.Ensuring that your webpage's images have alt attributes with relevant keywords is crucial for improving both SEO and accessibility.","Affected URL
https://restaurantpack.se/","How to Fix: To resolve the issue of missing keywords in alt attributes, follow these steps:Inspect Your HTML Code:

Review the HTML source code of your webpage to locate all instances of the <img> tag.

Add or Update Alt Attributes:

If the alt attribute is missing, add alt='Your description here' to the <img> tag.

If the alt attribute is present but lacks keywords, update the content with a relevant and descriptive summary including keywords.

Optimize the Alt Attributes:

Ensure that the alt attributes are unique and descriptive, and include relevant keywords for SEO purposes. They should accurately represent the content and context of the images.

Validate Your Changes:

Use SEOwallet or any other SEO audit tool to confirm that your images now have well-optimized alt attributes with relevant keywords.","Useful Links: For further guidance and best practices on managing your webpage's alt attributes, refer to the following resources:
Image Publishing Guidelines by Google 
https://developers.google.com/search/docs/appearance/google-images
Alt Text Best Practices 
https://seodebate.com/articles/alt-attribute/
These resources provide detailed information on how to create effective and compliant alt attributes for your images.","On-Page","High"
"Weakness","Max Title Length","Threat: Having a title tag that exceeds the recommended length can cause various issues. The <title> tag is essential for SEO as it defines the title of the webpage, which appears in search engine results and browser tabs. Titles that are too long may:Get truncated in search engine results, leading to incomplete and unclear titles.

Reduce click-through rates as users may not see the full context of the title.

Provide a poor user experience due to ambiguous or incomplete page titles.

Impact search engine ranking as search engines may prioritize concise and clear titles.Ensuring that your webpage has a single, well-optimized <title> tag within the recommended length is crucial for maintaining a clear and effective presence in search engine results.","Affected URL
https://restaurantpack.se/","How to Fix: To resolve the issue of a title tag exceeding the recommended length, follow these steps:Inspect Your HTML Code:

Review the HTML source code of your webpage to locate the <title> tag.

Shorten the Title:

Ensure that the <title> tag content is within the recommended length (typically 45-61 characters) for optimal display in search results.

Optimize the Title:

Make sure the title is unique, descriptive, and includes relevant keywords for SEO purposes. It should accurately represent the content of the page while remaining concise.

Validate Your Changes:

Use SEOwallet or any other SEO audit tool to confirm that your page's title is now within the recommended length and fully displayed in search results.","Useful Links: For further guidance and best practices on managing your webpage's title tags, refer to the following resources:
Title Tag Guidelines by Google
https://developers.google.com/search/docs/appearance/title-link
Meta Title Best Practices
https://seodebate.com/articles/meta-title/
These resources provide detailed information on how to create effective and compliant title tags for your web pages.","On-Page","Medium"
"Weakness","Hreflang: Missing Self-Referring","Threat: Having a missing self-referencing hreflang tag in the HTML source code of your webpage can cause various issues. The hreflang tag is important for SEO as it helps search engines understand the language and regional targeting of your web pages, ensuring the correct version is shown to the right users. A missing self-referencing hreflang tag can lead to:Incorrect or confusing language and regional targeting by search engines.

Poor user experience as users may see content not tailored to their language or region.

Potential duplicate content issues if search engines can't determine the canonical version.Ensuring that your webpage includes a self-referencing hreflang tag is crucial for maintaining accurate language and regional targeting in search engine results.","Affected URL
https://restaurantpack.se/","How to Fix: To resolve the issue of a missing self-referencing hreflang tag, follow these steps:Inspect Your HTML Code:

Review the HTML source code of your webpage to locate the existing hreflang tags.

Add the Self-Referencing Tag:

Add a self-referencing hreflang tag in the <head> section of your HTML document. The tag should look like this: <link rel='alternate' href='http://www.example.com' hreflang='x-default' /> <link rel='alternate' href='http://www.example.com' hreflang='en' /> Ensure that the href attribute points to the current page URL and the hreflang attribute corresponds to the language and region of the page.

Optimize and Validate:

Ensure that the self-referencing hreflang tag is correctly formatted and placed alongside other hreflang tags.

Use SEOwallet or any other SEO audit tool to confirm that your page now contains a valid self-referencing hreflang tag.","Useful Links: For further guidance and best practices on managing your webpage's hreflang tags, refer to the following resources:
Hreflang Guidelines by Google
https://developers.google.com/search/docs/specialty/international/localized-versions
Understanding and Implementing Hreflang Tags
https://seodebate.com/articles/hreflang/
These resources provide detailed information on how to create effective and compliant hreflang tags for your web pages.","Technical SEO","Medium"
"Weakness","Max Description Length","Threat: Having a meta description that exceeds the maximum recommended length can cause various issues. The meta description tag is important for SEO as it provides a summary of the webpage content, which appears in search engine results and can influence click-through rates. An overly long description can lead to:Truncation in search engine results, causing important information to be cut off.

Poor search engine ranking due to lack of concise, relevant content.

Decreased click-through rates as users may not see the complete summary.

Decreased user experience due to incomplete or misleading summaries in search results.Ensuring that your webpage has a single, well-optimized meta description tag of the appropriate length is crucial for maintaining a clear and effective presence in search engine results.","Affected URL
https://restaurantpack.se/","How to Fix: To resolve the issue of a meta description exceeding the maximum recommended length, follow these steps:Inspect Your HTML Code:

Review the HTML source code of your webpage to locate the meta description tag.

Edit the Description:

Shorten the content attribute of the <meta name='description' content='Your description here'> tag to meet the recommended length (typically 120-151 characters).

Optimize the Description:

Ensure that the description is concise, unique, and includes relevant keywords for SEO purposes. It should accurately represent the content of the page without exceeding the recommended length.

Validate Your Changes:

Use SEOwallet or any other SEO audit tool to confirm that your page now contains a well-optimized meta description tag of the appropriate length.","Useful Links: For further guidance and best practices on managing your webpage's meta description tags, refer to the following resources:
Meta Description Guidelines by Google
https://developers.google.com/search/docs/appearance/snippet
Meta Description Best Practices
https://seodebate.com/articles/meta-description/
These resources provide detailed information on how to create effective and compliant meta-description tags for your web pages.","On-Page","Low"
"Weakness","Missing OG Image","Threat: Having a missing <meta property='og:image'> tag in the HTML source code of your webpage can cause various issues. The Open Graph (OG) image tag is important for social media optimization as it provides a preview image when your webpage is shared on social platforms. A missing OG image can lead to:Poor social media sharing experience due to lack of a visual preview.

Decreased click-through rates from social media as users may not find the post visually appealing.

Inconsistent branding and message presentation on social platforms.

Reduced engagement and shares on social media posts.Ensuring that your webpage has a properly set OG image tag is crucial for maintaining a strong and appealing presence on social media platforms.","Affected URL
https://restaurantpack.se/","How to Fix: To resolve the issue of a missing OG image tag, follow these steps:Inspect Your HTML Code:

Review the HTML source code of your webpage to locate the OG image tag.

Add the OG Image Tag:

Add a <meta property='og:image' content='URL_of_your_image'> tag in the <head> section of your HTML document.

Choose an Appropriate Image:

Ensure that the image is of high quality, relevant to the content, and meets the recommended size and aspect ratio for social media sharing (typically at least 1200 x 630 pixels).

Optimize the Image:

Ensure that the image file is optimized for fast loading times and is in a suitable format (e.g., JPEG, PNG).

Validate Your Changes:

Use social media debugging tools like the Facebook Sharing Debugger or Twitter Card Validator to confirm that your page now includes a valid OG image tag.","Useful Links: For further guidance and best practices on managing your webpage's OG image tags, refer to the following resources:
Open Graph Protocol
http://ogp.me/
These resources provide detailed information on how to create effective and compliant OG image tags for your web pages.","On-Page","Low"